{
  "$schema": "../schema/case.schema.json",
  "schemaVersion": "0.1",
  "id": "security.package.tampered-entry",
  "title": "Reject a package whose entry payload was modified",
  "status": "draft",
  "area": "security",
  "tags": ["adversarial", "integrity", "package"],
  "specReferences": [
    "NotMarkdown-v0.1-Draft.md section 13.4",
    "NotMarkdown-v0.1-Draft.md section 15"
  ],
  "operation": {
    "name": "open-package"
  },
  "input": {
    "fixtures": [
      {
        "role": "package",
        "path": "NotMarkdown-example-modern-0.1.nmdoc",
        "mediaType": "application/vnd.notmarkdown.document+zip",
        "sha256": "47ede689bedeb0fa05b95f7e4549c434ecdfd3b318712e29d50720f7d8d1f0fc"
      }
    ],
    "mutations": [
      {
        "kind": "flip-entry-payload-byte",
        "entry": "document.nmt",
        "offset": 0
      }
    ]
  },
  "expected": {
    "outcome": "rejected",
    "assertions": []
  },
  "notes": "Draft until the mutation recipe has stable byte-level semantics across ZIP implementations."
}

